sector,object,apf_trace,best_external_lane,status,result,first_failed_or_boundary,source_package
bottom,m_b,4.1774904559270665 GeV,MSbar self-scale m_b(m_b),[P_export_candidate_not_physical_final],Residual vs PDG 2025 MSbar self-scale: -5.509544 MeV; quoted-scale pull -0.787 sigma.,PUBLICATION_REVIEW_OF_BOTTOM_TRACE_MSBAR_CODOMAIN_ADMISSION,APF_v24_BOTTOM_MSBAR_EXPORT_CANDIDATE.zip
top,m_t,168.1690557938 GeV,external high-scale MSR codomain,[P_trace + P_ext-MSR_codomain + P_terminal_scheme_closeout],"Direct/MC/pole, self-scale MSbar, and EW Delta-rho substitution are knocked out; external MSR lane closes only as codomain pass.",APF_NATIVE_TOP_TRACE_TO_MSR_SCALE_SELECTION_THEOREM_WITHOUT_EXTERNAL_POLE_ANCHOR,APF_v30_TOP_FINAL_CLOSEOUT.zip
charged_leptons,"e, mu, tau","(1.290305474, 261.429844901, 4178.022853) MeV before normalization",six-channel normalization candidate followed by generation-residual obstruction,[P_trace_vector + P_normalization_candidate + P_generation_residual_closeout],"lambda_6=1/sqrt(6) reduces residuals to about +3.09%, +1.01%, -4.02%, but no generation residual operator is derived.",APF_CHARGED_LEPTON_GENERATION_RESIDUAL_OPERATOR_DERIVATION,APF_v27_CHARGED_LEPTON_GENERATION_RESIDUAL_CLOSEOUT.zip
charm,m_c,0.6800912249261419 GeV,MSbar self-scale m_c(m_c) tested and rejected,[P_trace + P_MSbar_route_knockout],"Residual vs PDG 2025 MSbar self-scale: -0.592908775074 GeV, about -46.6%; direct export rejected.",APF_CHARM_TRACE_TO_MSBAR_NORMALIZATION_OR_TRANSPORT_MAP,APF_v31_CHARM_MSBAR_TRANSPORT.zip
light_quarks,"u,d,s","u=1.153209852 MeV, d=3.870916422 MeV, s=87.143281634 MeV","MSbar(2 GeV), pole, self-scale, constituent, and simple-ratio routes tested and rejected",[P_trace + P_low_energy_QCD_obstruction],"Direct MSbar(2 GeV) export knocked out for u,d,s; low-energy QCD/chiral/lattice transport map required.",APF_LIGHT_QUARK_TRACE_TO_MSBAR_2GEV_CHIRAL_LATTICE_TRANSPORT_MAP,APF_v32_LIGHT_QUARK_OBSTRUCTION_MAP.zip
