ledger_item,v51_content,v51_status,no_smuggling_guard
scheme_family,"MSbar self-scale for c,b; MSR(R_star) for top",declared,G1 codomain declared per sector
scale_mu,"mu=mc, mu=mb, R=R_star",declared,"scale is part of codomain, not a fit variable"
alpha_s_reference,alpha_s(MZ) or alpha_s(mu) with covariance,required_for_full_QCD,not selected from residuals
beta_function_order,loop order L_beta,required_for_full_QCD,must be fixed before comparison
mass_anomalous_dimension_order,loop order L_gamma_m,required_for_full_QCD,must be fixed before comparison
threshold_matching,decoupling thresholds and matching convention,required_for_full_QCD,thresholds cannot be tuned per quark
scheme_conversion,MSbar<->MSR<->pole/MC coefficients where requested,required_for_downstream_conversion,top conversion remains boundary
covariance_matrix,"joint covariance for alpha_s, thresholds, perturbative truncation, external references",required_for_publication_final,"residuals assigned, not absorbed"
forbidden_target_reuse,"no solving ledger constants from c,b,t target masses",closed,G5 no-smuggling guard
