sector,trace_object,codomain,route_status,physical_export_status,first_failed_gate_or_boundary
EW/W,sin^2thetaW=3/13; MW_TRACE=80.362164334 GeV,on-shell EW via DIZET,reviewed same-input transport + admitted row covariance,P_export_candidate,publication review of DIZET row admission protocol
bottom,mb_TRACE=4.177490455927 GeV,self-scale MSbar mb(mb),codomain admitted,P_export_candidate,publication review of bottom trace MSbar codomain admission
charged leptons,"(e,mu,tau)_TRACE",pole/running QED,scalar normalization + residual operator + APF coefficient closure + v40 trace-vector source gate; pole codomain declared only,not exported; P_source_gate^T_l + P_codomain^pole_ready,APF_LEPTON_COOPERATIVE_OVERLAP_OR_TRACE_VECTOR_CLOSURE_THEOREM
top,mt_TRACE=168.1690557938 GeV,MSR at R_star=85.86 GeV,native APF scale selector + identity MSR codomain admission,P_export_candidate,downstream MSR-to-pole/MC/MSbar residual transport remains separate
charm,mc_TRACE=0.680091224926 GeV,self-scale MSbar mc(mc),route knockout,not exported,APF_CHARM_TRACE_TO_MSBAR_NORMALIZATION_OR_TRANSPORT_MAP
light quarks,"(u,d,s)_TRACE",MSbar(2 GeV) / chiral lattice,low-energy QCD obstruction,not exported,APF_LIGHT_QUARK_TRACE_TO_MSBAR_2GEV_CHIRAL_LATTICE_TRANSPORT_MAP
